{
  "companyName": "אורן טכנולוגיות בע\"מ",
  "reportYear": 2024,
  "currencyUnits": "אלפי ש\"ח",
  "balanceSheetLineItems": [
    {
      "section": "נכסים",
      "label": "מזומנים ושווי מזומנים",
      "currentYearAmount": 1250,
      "priorYearAmount": 980
    },
    {
      "section": "נכסים",
      "label": "לקוחות",
      "currentYearAmount": 3420,
      "priorYearAmount": 2890
    },
    {
      "section": "נכסים",
      "label": "מלאי",
      "currentYearAmount": 1870,
      "priorYearAmount": 2100
    },
    {
      "section": "נכסים",
      "label": "רכוש קבוע, נטו",
      "currentYearAmount": 5640,
      "priorYearAmount": 6010
    },
    {
      "section": "התחייבויות והון",
      "label": "ספקים",
      "currentYearAmount": 2150,
      "priorYearAmount": 1940
    },
    {
      "section": "התחייבויות והון",
      "label": "הלוואות לזמן קצר",
      "currentYearAmount": 1800,
      "priorYearAmount": 2200
    },
    {
      "section": "התחייבויות והון",
      "label": "הלוואות לזמן ארוך",
      "currentYearAmount": 3400,
      "priorYearAmount": 3900
    },
    {
      "section": "התחייבויות והון",
      "label": "הון מניות",
      "currentYearAmount": 2000,
      "priorYearAmount": 2000
    },
    {
      "section": "התחייבויות והון",
      "label": "עודפים",
      "currentYearAmount": 2830,
      "priorYearAmount": 1940
    }
  ],
  "totalAssets": 12180,
  "totalLiabilitiesAndEquity": 12180,
  "incomeStatementLineItems": [
    {
      "label": "הכנסות ממכירות",
      "currentYearAmount": 18500,
      "priorYearAmount": 16200
    },
    {
      "label": "עלות המכר",
      "currentYearAmount": -11100,
      "priorYearAmount": -9720
    },
    {
      "label": "הוצאות הנהלה וכלליות",
      "currentYearAmount": -3200,
      "priorYearAmount": -2950
    },
    {
      "label": "הוצאות מימון",
      "currentYearAmount": -480,
      "priorYearAmount": -560
    }
  ],
  "netIncome": 3720
}